{
  "schema_version": 1,
  "task_id": "job-execution-public-0003",
  "call_id": "call-execution-public-0003",
  "tool": "android.adjust_volume",
  "status": "cancelled",
  "error_code": "global_stop",
  "output": {},
  "started_at_elapsed_ms": 140000,
  "finished_at_elapsed_ms": 140004,
  "duration_ms": 4,
  "adapter_calls": 1,
  "public_log_safe": false
}
